line_no,word,pos_list,sense_idx,sense_pos_chip,sense_text,source_pos,source_def_idx,source_cefr,source_cefr_origin,source_oxford_badge,declared_cefr,status,reason,match_kind
1123,immigration,noun,2,,"the place at a port, an airport, etc. where the passports and other documents of people coming into a country are checked",noun,2,B2,per-def,B2,B2,match,,exact-norm
1124,imminent,adjective,1,,likely to happen very soon,adjective,1,C1,oxford-badge,C1,C1,match,,exact-norm
1125,immortality,noun,1,,the state of living or lasting forever,noun,1,UNCLASSIFIED,none,,UNCLASSIFIED,match,,exact-norm
1126,immune,adjective,1,,that cannot catch or be affected by a particular disease or illness,adjective,1,B2,per-def,B2,B2,match,,exact-norm
1127,impactful,adjective,1,,having a major impact or effect,adjective,1,UNCLASSIFIED,none,,UNCLASSIFIED,match,,exact-norm
1128,impair,verb,1,,to damage something or make something worse,verb,1,UNCLASSIFIED,none,,UNCLASSIFIED,match,,exact-norm
1129,implement,verb,1,,to make something that has been officially decided start to happen or be used,verb,1,B2,oxford-badge,B2,B2,match,,exact-norm
1130,implementation,noun,1,,the act of making something that has been officially decided start to happen or be used,noun,1,C1,oxford-badge,C1,C1,match,,exact-norm
1131,implicate,verb,1,,to show or suggest that somebody is involved in something bad or criminal ; to show or suggest that something is the cause of something bad,verb,1,UNCLASSIFIED,none,,UNCLASSIFIED,match,,fuzzy-jaccard=0.80
1132,implication,noun,1,,a possible effect or result of an action or a decision,noun,1,B2,per-def,B2,B2,match,,exact-norm
1133,implicit,adjective,1,,suggested without being directly expressed,adjective,1,C1,per-def,,C1,match,,exact-norm
1134,implicit,adjective,1,,suggested without being directly expressed,adjective,1,C1,per-def,,UNCLASSIFIED,mismatch,"cefr-mismatch (deck=UNCLASSIFIED, source=C1 [per-def])",exact-norm
1135,imply,verb,1,,"to suggest that something is true without saying so directly, or to make it seem likely",verb,2,B2,per-def,B2,B2,match,,fuzzy-jaccard=0.62
1136,impose,verb,1,,"to introduce a new law, rule, tax, etc.; to order that a rule, punishment, etc. be used ; to force somebody/something to have to deal with something that is difficult or unpleasant",verb,1,B2,per-def,B2,B2,match,,fuzzy-jaccard=0.55
1137,imprison,verb,1,,to put somebody in a prison or another place from which they cannot escape,verb,1,C1,oxford-badge,C1,C1,match,,exact-norm
1138,imprisonment,noun,1,,the act of putting somebody in a prison or another place from which they cannot escape; the state of being there,noun,1,C1,oxford-badge,C1,C1,match,,exact-norm
1139,impulse,noun,1,,"a sudden strong wish or need to do something, without stopping to think about the results",noun,1,UNCLASSIFIED,none,,UNCLASSIFIED,match,,exact-norm
1139,impulse,noun,2,,a force or movement of energy that causes something else to react,noun,2,UNCLASSIFIED,none,,UNCLASSIFIED,match,,exact-norm
1139,impulse,noun,3,,something that causes somebody/something to do something or to develop and make progress,noun,3,UNCLASSIFIED,none,,UNCLASSIFIED,match,,exact-norm
1140,impulsive,adjective,1,,acting suddenly without thinking carefully about what might happen because of what you are doing,adjective,1,UNCLASSIFIED,none,,UNCLASSIFIED,match,,exact-norm
1141,inability,noun,1,,the fact of not being able to do something,noun,1,C1,oxford-badge,C1,C1,match,,exact-norm
1142,inadequate,adjective,1,,not enough; not good enough,adjective,1,C1,per-def,C1,C1,match,,exact-norm
1142,inadequate,adjective,2,,"not able, or not confident enough, to deal with a situation",adjective,2,C1,per-def,C1,C1,match,,exact-norm
1143,inappropriate,adjective,1,,not suitable or appropriate in a particular situation,adjective,1,C1,oxford-badge,C1,C1,match,,exact-norm
1144,incantation,noun,1,,special words that are spoken or sung to have a magic effect; the act of speaking or singing these words,noun,1,UNCLASSIFIED,none,,UNCLASSIFIED,match,,exact-norm
1145,incentive,noun,1,,something that encourages you to do something,noun,1,B2,per-def,B2,B2,match,,exact-norm
1146,incentivize,verb,1,,to encourage somebody to behave in a particular way by offering them a reward,verb,1,UNCLASSIFIED,none,,UNCLASSIFIED,match,,exact-norm
1147,inception,noun,1,,"the start of an institution, an organization, etc.",noun,1,UNCLASSIFIED,none,,UNCLASSIFIED,match,,exact-norm
1148,incidence,noun,1,,the extent to which something happens or has an effect,noun,1,C1,per-def,C1,C1,match,,exact-norm
1149,incline,noun|verb,1,,a slope,noun,1,UNCLASSIFIED,none,,UNCLASSIFIED,match,no-per-sense-pos-in-deck; flat-matched,exact-norm
1149,incline,noun|verb,2,,"to bend your head forward, especially as a sign of agreement, welcome, etc.",verb,2,C2,per-def,,UNCLASSIFIED,mismatch,"cefr-mismatch (deck=UNCLASSIFIED, source=C2 [per-def]); no-per-sense-pos-in-deck; flat-matched",exact-norm
1150,inclined,adjective,1,,wanting to do something,adjective,1,C1,per-def,C1,C1,match,,exact-norm
1150,inclined,adjective,2,,tending to do something; likely to do something,adjective,2,C1,per-def,C1,C1,match,,exact-norm
1150,inclined,adjective,3,,used when you are expressing an opinion but do not want to express it very strongly,adjective,3,C1,per-def,C1,C1,match,,exact-norm
1151,inclusion,noun,1,,the fact of including somebody/something; the fact of being included,noun,1,C1,per-def,C1,C1,match,,exact-norm
1151,inclusion,noun,2,,a person or thing that is included,noun,2,C1,per-def,C1,C1,match,,exact-norm
1152,incompetence,noun,1,,the lack of skill or ability to do your job or a task as it should be done,noun,1,UNCLASSIFIED,none,,UNCLASSIFIED,match,,exact-norm
1153,inconvenience,noun,1,,"trouble or problems, especially in connection with what you need or would like yourself",noun,1,C1,per-def,,C1,match,,exact-norm
1153,inconvenience,noun,2,,a person or thing that causes problems or difficulties,noun,2,C1,per-def,,C1,match,,exact-norm
1154,incorporate,verb,1,,to include something so that it forms a part of something,verb,1,B2,per-def,B2,B2,match,,exact-norm
1155,incorrect,adjective,1,,not accurate or true,adjective,1,B2,per-def,B2,B2,match,,exact-norm
1156,incur,verb,1,,"if you incur something unpleasant, you are in a situation in which you have to deal with it",verb,1,C1,per-def,C1,C1,match,,exact-norm
1156,incur,verb,2,,"if you incur costs, you have to pay them",verb,2,C1,per-def,C1,C1,match,,exact-norm
1157,indeed,adverb,1,,"used after very and an adjective or adverb to emphasize a statement, description, etc.",adverb,1,B1,per-def,B1,B1,match,,exact-norm
1157,indeed,adverb,2,,used to emphasize a positive statement or answer,adverb,2,B1,per-def,B1,B1,match,,exact-norm
1158,independence,noun,1,,"freedom from political control by other countries ; the time when a country gains freedom from political control by another country ; the freedom to organize your own life, make your own decisions, etc. without needing help from other people",noun,3,B2,per-def,B2,B2,match,,fuzzy-jaccard=0.64
1159,independent,adjective,1,,having its own government,adjective,1,A2,per-def,A2,A2,match,,exact-norm
1160,index,noun,1,,"a list of names or topics that are referred to in a book, etc., usually arranged at the end of a book in alphabetical order or listed in a separate file or book",noun,1,B2,per-def,B2,B2,match,,exact-norm
1161,indication,noun,1,,a remark or sign that shows that something is happening or what somebody is thinking or feeling,noun,1,B2,per-def,B2,B2,match,,exact-norm
1162,indicator,noun,1,,a sign that shows you what something is like or how a situation is changing,noun,1,C1,per-def,C1,C1,match,,exact-norm
1162,indicator,noun,2,,a light on a vehicle that flashes to show that the vehicle is going to turn left or right,noun,3,C1,per-def,C1,C1,match,,exact-norm
1163,indictment,noun,1,,"a sign that a system, society, etc. is very bad or very wrong",noun,1,C1,per-def,C1,C1,match,,exact-norm
1164,indigenous,adjective,1,,"coming from a particular place and having lived there for a long time before other people came there; relating to, belonging to or developed by these people",adjective,1,C1,per-def,C1,C1,match,,exact-norm
1164,indigenous,adjective,2,,"having originally developed in a particular place, rather than having been brought there from somewhere else",adjective,2,C1,per-def,C1,C1,match,,exact-norm
1165,induce,verb,1,,to persuade or influence somebody to do something,verb,1,C1,per-def,C1,C1,match,,exact-norm
1165,induce,verb,2,,to cause something,verb,2,C1,per-def,C1,C1,match,,exact-norm
1166,indulge,verb,1,,"to allow yourself to have or do something that you like, especially something that is considered bad for you",verb,1,C1,per-def,C1,C1,match,,exact-norm
1167,ineffective,adjective,1,,not achieving what you want to achieve; not having any effect,adjective,1,UNCLASSIFIED,none,,UNCLASSIFIED,match,,exact-norm
1168,inequality,noun,1,,"the unfair difference between groups of people in society, when some have more wealth, status or opportunities than others",noun,1,C1,oxford-badge,C1,C1,match,,exact-norm
1169,inevitable,adjective,1,,that you cannot avoid or prevent,adjective,1,B2,per-def,B2,B2,match,,exact-norm
1169,inevitable,adjective,2,,something that is certain to happen,adjective,3,B2,per-def,B2,B2,match,,exact-norm
1170,inevitably,adverb,1,,as is certain to happen,adverb,1,B2,per-def,B2,B2,match,,exact-norm
1171,infamous,adjective,1,,well known for being bad or evil,adjective,1,C1,oxford-badge,C1,C1,match,,exact-norm
1172,infant,noun,1,,a baby or very young child,noun,1,C1,per-def,C1,C1,match,,exact-norm
1172,infant,noun,2,,a child at school between the ages of four and seven,noun,2,C1,per-def,C1,C1,match,,exact-norm
1173,infect,verb,1,,"to make a disease or an illness spread to a person, an animal or a plant",verb,1,C1,per-def,C1,C1,match,,exact-norm
1173,infect,verb,2,,to make a substance contain harmful bacteria that can spread disease,verb,2,C1,per-def,C1,C1,match,,exact-norm
1173,infect,verb,3,,to make a computer virus spread to another computer or program,verb,3,C1,per-def,C1,C1,match,,exact-norm
1174,infection,noun,1,,the act or process of causing or getting a disease ; an illness that is caused by bacteria or a virus and that affects one part of the body,noun,2,B2,per-def,B2,B2,match,,fuzzy-jaccard=0.76
1175,infer,verb,1,,to reach an opinion or decide that something is true on the basis of information that is available,verb,1,B2,per-def,B2,B2,match,,exact-norm
1176,inflammation,noun,1,,"a condition in which a part of the body becomes red, painful and swollen (= larger than normal) because of infection or injury",noun,1,UNCLASSIFIED,none,,UNCLASSIFIED,match,,exact-norm
1177,inflammatory,adjective,1,,intended to cause very strong feelings of anger,adjective,1,UNCLASSIFIED,none,,UNCLASSIFIED,match,,exact-norm
1177,inflammatory,adjective,2,,causing or involving inflammation,adjective,2,UNCLASSIFIED,none,,UNCLASSIFIED,match,,exact-norm
1178,inflation,noun,1,,a fall in the value of money and a general increase in prices; the rate at which this happens,noun,1,B2,per-def,B2,B2,match,,exact-norm
1179,inflict,verb,1,,to make somebody/something suffer something unpleasant,verb,1,C1,oxford-badge,C1,C1,match,,exact-norm
1180,influential,adjective,1,,having a lot of influence on somebody/something,adjective,1,C1,oxford-badge,C1,C1,match,,exact-norm
1181,info,noun,1,,information,noun,1,B2,per-def,B2,B2,match,,exact-norm
1182,infrastructure,noun,1,,"the basic systems and services that are necessary for a country or an organization to run smoothly, for example buildings, transport and water and power supplies",noun,1,B2,oxford-badge,B2,B2,match,,exact-norm
1183,ingenuity,noun,1,,the ability to invent things or solve problems in clever new ways,noun,1,UNCLASSIFIED,none,,UNCLASSIFIED,match,,exact-norm
1184,ingrained,adjective,1,,deeply established and difficult to change or remove,,,,,,UNCLASSIFIED,mismatch,sense-text-not-in-source,none
1185,inhabitant,noun,1,,a person or an animal that lives in a particular place,noun,1,B2,oxford-badge,B2,B2,match,,exact-norm
1186,inherent,adjective,1,,that is a basic or permanent part of somebody/something and that cannot be removed,adjective,1,C1,oxford-badge,C1,C1,match,,exact-norm
1187,inherit,verb,1,,"to receive money, property, etc. from somebody when they die ; to have qualities, physical features, etc. that are similar to those of your parents, grandparents, etc.",verb,2,B2,per-def,B2,B2,match,,fuzzy-jaccard=0.64
1188,inhibit,verb,1,,to prevent something from happening or make it happen more slowly or less frequently than normal ; to make somebody nervous or embarrassed so that they are unable to do something,verb,1,C1,per-def,C1,C1,match,,fuzzy-jaccard=0.62
1189,inhibited,adjective,1,,unable to relax or express your feelings in a natural way,adjective,1,UNCLASSIFIED,none,,UNCLASSIFIED,match,,exact-norm
1190,initial,adjective,1,,happening at the beginning; first,adjective,1,B2,oxford-badge,B2,B2,match,,exact-norm
1191,initiate,verb,1,,to make something begin,verb,1,C1,per-def,C1,C1,match,,exact-norm
1191,initiate,verb,2,,to explain something to somebody and/or make them experience it for the first time,verb,2,C1,per-def,C1,C1,match,,exact-norm
1192,inject,verb,1,,to put a drug or other substance into a person’s or an animal’s body using a syringe,verb,1,C1,per-def,C1,C1,match,,exact-norm
1192,inject,verb,2,,to put a liquid or other substance into something using a syringe or similar instrument,verb,2,C1,per-def,C1,C1,match,,exact-norm
1193,injection,noun,1,,an act of injecting somebody with a drug or other substance,noun,1,C1,per-def,C1,C1,match,,exact-norm
1194,injustice,noun,1,,the fact of a situation being unfair and of people not being treated equally; an unfair act or an example of unfair treatment,noun,1,C1,oxford-badge,C1,C1,match,,exact-norm
1195,ink,noun,1,,"coloured liquid for writing, drawing and printing",noun,1,B2,per-def,B2,B2,match,,exact-norm
1196,inmate,noun,1,,one of the people living in an institution such as a prison or a psychiatric hospital,noun,1,C1,oxford-badge,C1,C1,match,,exact-norm
1197,innovate,verb,1,,"to introduce new things, ideas or ways of doing something",verb,1,UNCLASSIFIED,none,,UNCLASSIFIED,match,,exact-norm
1198,innovation,noun,1,,"the introduction of new things, ideas or ways of doing something",noun,1,B2,per-def,B2,B2,match,,exact-norm
1198,innovation,noun,2,,"a new idea, way of doing something, etc. that has been introduced or discovered",noun,2,B2,per-def,B2,B2,match,,exact-norm
1199,innovative,adjective,1,,"introducing or using new ideas, ways of doing something, etc.",adjective,1,B2,oxford-badge,B2,B2,match,,exact-norm
1200,input,noun,1,,"time, knowledge, ideas, etc. that you put into work, a project, etc. in order to make it succeed; the act of putting something in",noun,1,B2,per-def,B2,B2,match,,exact-norm
1200,input,noun,2,,the act of putting information into a computer; the information that you put in,noun,2,B2,per-def,B2,B2,match,,exact-norm
1201,insecurity,noun,1,,a lack of confidence about yourself or your relationships with other people; something that makes you feel like this,noun,1,C1,per-def,,C1,match,,exact-norm
1202,insecurity,noun,1,,a lack of confidence about yourself or your relationships with other people; something that makes you feel like this,noun,1,C1,per-def,,UNCLASSIFIED,mismatch,"cefr-mismatch (deck=UNCLASSIFIED, source=C1 [per-def])",exact-norm
1203,insert,verb,1,,"to put something into something else, whether a physical object or a piece of writing",,,,,B2,B2,mismatch,sense-text-not-in-source,none
1204,insertion,noun,1,,the act of putting something inside something else; a thing that is put inside something else,noun,1,C1,per-def,C1,C1,match,,exact-norm
1205,insider,noun,1,,"a person who knows a lot about a group or an organization, because they are part of it",noun,1,C1,oxford-badge,C1,C1,match,,exact-norm
1206,insight,noun,1,,an understanding of what something is like ; the ability to see and understand the truth about people or situations,noun,2,B2,per-def,B2,B2,match,,fuzzy-jaccard=0.61
1207,inspect,verb,1,,"to look closely at something/somebody, especially to check that everything is as it should be ; to officially visit a school, factory, etc. in order to check that rules are being obeyed and that standards are acceptable",verb,2,C1,per-def,C1,C1,match,,fuzzy-jaccard=0.59
1208,inspection,noun,1,,"an act of looking closely at something, especially to check that it is correct, safe, or as it should be",noun,2,C1,per-def,C1,C1,match,,fuzzy-jaccard=0.68
1209,inspector,noun,1,,an officer of middle rank in the police force,noun,1,B2,per-def,B2,B2,match,,exact-norm
1209,inspector,noun,2,,(in the UK) a person whose job is to check tickets on a bus or train,noun,3,B2,per-def,B2,B2,match,,exact-norm
1210,inspiration,noun,1,,"the process that takes place when somebody sees or hears something that causes them to have exciting new ideas or makes them want to create something, especially in art, music or literature ; a person or thing that is the reason why somebody creates or does something ; a person or thing that makes you want to be better, more successful, etc. ; a sudden good idea",noun,1,C1,per-def,C1,C1,match,,fuzzy-jaccard=0.62
1211,installation,noun,1,,the act of fixing equipment or furniture in position so that it can be used,noun,1,B2,per-def,B2,B2,match,,exact-norm
1212,instant,adjective,1,,happening immediately,adjective,1,B2,per-def,B2,B2,match,,exact-norm
1212,instant,adjective,2,,"that can be made quickly and easily, usually by adding hot water",adjective,2,B2,per-def,B2,B2,match,,exact-norm
1213,instantly,adverb,1,,immediately,adverb,1,B2,oxford-badge,B2,B2,match,,exact-norm
1214,instinct,noun,1,,"a natural quality that makes people and animals tend to behave in a particular way using the knowledge and abilities that they were born with rather than thought or training ; a feeling that makes you do something or believe that something is true, even though it is not based on facts or reason",noun,1,C1,per-def,C1,C1,match,,fuzzy-jaccard=0.63
1215,institution,noun,1,,"a large important organization that has a particular purpose, for example a university or bank",noun,1,B2,per-def,B2,B2,match,,exact-norm
1216,institutional,adjective,1,,"connected with a large important organization, for example a university or bank",adjective,1,C1,per-def,C1,C1,match,,exact-norm
1216,institutional,adjective,2,,"in or like a place where people are sent to live and be cared for, for example a hospital, prison or special school",adjective,2,C1,per-def,C1,C1,match,,exact-norm
1216,institutional,adjective,3,,"established as part of the normal systems, practices, etc. of an organization, society or culture",adjective,3,C1,per-def,C1,C1,match,,exact-norm
1217,instruct,verb,1,,"to tell somebody to do something, especially in a formal or official way",verb,1,C1,per-def,C1,C1,match,,exact-norm
1217,instruct,verb,2,,"to teach somebody something, especially a practical skill",verb,2,C1,per-def,C1,C1,match,,exact-norm
1218,instrumental,adjective,1,,important in making something happen,adjective,1,C1,per-def,C1,C1,match,,exact-norm
1218,instrumental,adjective,2,,made by or for musical instruments,adjective,2,C1,per-def,C1,C1,match,,exact-norm
1219,insufficient,adjective,1,,"not large, strong or important enough for a particular purpose",adjective,1,C1,oxford-badge,C1,C1,match,,exact-norm
1220,insult,noun|verb,1,,a remark or an action that is said or done in order to offend somebody,noun,1,C1,oxford-badge,C1,C1,match,no-per-sense-pos-in-deck; flat-matched,exact-norm
1220,insult,noun|verb,2,,to say or do something that offends somebody,verb,1,C1,oxford-badge,C1,C1,match,no-per-sense-pos-in-deck; flat-matched,exact-norm
1221,intact,adjective,1,,complete and not damaged,adjective,1,C1,oxford-badge,C1,C1,match,,exact-norm
1222,intake,noun,1,,"the amount of food, drink, etc. that you take into your body",noun,1,C1,per-def,C1,C1,match,,exact-norm
1222,intake,noun,2,,"the people who are allowed to enter a school, college, profession, etc. during a particular period",noun,2,C1,per-def,C1,C1,match,,exact-norm
1223,intangible,adjective,1,,"that exists but cannot be touched; difficult to describe, understand or measure",adjective,1,UNCLASSIFIED,none,,UNCLASSIFIED,match,,exact-norm
1223,intangible,adjective,2,,that does not exist as a physical thing but is still valuable to a company,adjective,2,UNCLASSIFIED,none,,UNCLASSIFIED,match,,exact-norm
1224,integral,adjective,1,,being an essential part of something,adjective,1,C1,per-def,C1,C1,match,,exact-norm
1224,integral,adjective,2,,"included as part of something, rather than supplied separately",adjective,2,C1,per-def,C1,C1,match,,exact-norm
1225,integrate,verb,1,,to combine two or more things so that they work together; to combine with something else in this way,verb,1,B2,per-def,B2,B2,match,,exact-norm
1226,integrated,adjective,1,,in which many different parts are closely connected and work successfully together,adjective,1,C1,per-def,C1,C1,match,,exact-norm
1227,integration,noun,1,,"the act or process of combining two or more things so that they work together ; the act or process of mixing people who have previously been separated, usually because of colour, race, religion, etc.",noun,2,C1,per-def,C1,C1,match,,fuzzy-jaccard=0.67
1228,integrity,noun,1,,the quality of being honest and having strong moral principles,noun,1,C1,per-def,C1,C1,match,,exact-norm
1229,intellectual,adjective,1,,connected with or using a person’s ability to think in a logical way and understand things,adjective,1,B2,per-def,B2,B2,match,,exact-norm
1230,intellectual,noun,1,,a person who is well educated and enjoys activities in which they have to think seriously about things,noun,1,B2,oxford-badge,B2,C1,mismatch,"cefr-mismatch (deck=C1, source=B2 [oxford-badge])",exact-norm
1231,intense,adjective,1,,very great; very strong ; serious and often involving a lot of action in a short period of time,adjective,2,B2,per-def,B2,B2,match,,fuzzy-jaccard=0.79
1232,intensify,verb,1,,to increase in degree or strength; to make something increase in degree or strength,verb,1,C1,oxford-badge,C1,C1,match,,exact-norm
1233,intensity,noun,1,,the state or quality of being intense,noun,1,C1,per-def,C1,C1,match,,exact-norm
1234,intensive,adjective,1,,involving a lot of work or activity done in a short time ; complete and extremely detailed; done with a lot of care ; aimed at producing as much food as possible using as little land or as little money as possible,,,,,C1,C1,mismatch,sense-text-not-in-source,none
1235,intent,noun,1,,what you intend to do,noun,1,C1,oxford-badge,C1,C1,match,,exact-norm
1236,interact,verb,1,,"to communicate with somebody, especially while you work, play or spend time with them",verb,1,B2,per-def,B2,B2,match,,exact-norm
1237,interaction,noun,1,,"the act of communicating with somebody, especially while you work, play or spend time with them",noun,1,B2,per-def,B2,B2,match,,exact-norm
1238,interactive,adjective,1,,that allows information to be passed continuously and in both directions between a computer or other device and the person who uses it ; that involves people working together and having an influence on each other,adjective,1,C1,per-def,C1,C1,match,,fuzzy-jaccard=0.70
1239,interface,noun,1,,"the way a computer program presents information to a user or receives information from a user, in particular the layout of the screen and the menus",noun,1,C1,per-def,C1,C1,match,,exact-norm
1240,interfere,verb,1,,"to get involved in and try to influence a situation that should not really involve you, in a way that annoys other people",verb,1,C1,oxford-badge,C1,C1,match,,exact-norm
1241,interference,noun,1,,"the act of getting involved in and trying to influence a situation that should not really involve you, in a way that annoys other people",noun,1,C1,per-def,C1,C1,match,,exact-norm
1242,interim,adjective,1,,intended to last for only a short time until somebody/something more permanent is found,adjective,1,C1,per-def,C1,C1,match,,exact-norm
1243,interior,adjective|noun,1,,connected with the inside part of something,adjective,1,C1,per-def,C1,C1,match,no-per-sense-pos-in-deck; flat-matched,exact-norm
1243,interior,adjective|noun,2,,the inside part of something,noun,1,C1,per-def,C1,C1,match,no-per-sense-pos-in-deck; flat-matched,exact-norm
1243,interior,adjective|noun,3,,the central part of a country or continent that is a long way from the coast,noun,2,C1,per-def,C1,C1,match,no-per-sense-pos-in-deck; flat-matched,exact-norm
1244,intermediate,adjective,1,,"located between two places, things, states, etc.",adjective,1,C1,per-def,C1,C1,match,,exact-norm
1244,intermediate,adjective,2,,having more than a basic knowledge of something but not yet advanced; suitable for somebody who is at this level,adjective,2,C1,per-def,C1,C1,match,,exact-norm
1245,interpretation,noun,1,,the particular way in which something is understood or explained,noun,1,B2,per-def,B2,B2,match,,exact-norm
1246,interval,noun,1,,"a period of time between two events ; a short period of time separating parts of a play, film or concert",noun,2,B2,per-def,B2,B2,match,,fuzzy-jaccard=0.77
1247,intervene,verb,1,,to become involved in a situation in order to improve or help it,verb,1,C1,per-def,C1,C1,match,,exact-norm
1248,intervention,noun,1,,action taken to improve or help a situation,noun,1,C1,per-def,C1,C1,match,,exact-norm
1248,intervention,noun,2,,action by a country to become involved in the affairs of another country when they have not been asked to do so,noun,2,C1,per-def,C1,C1,match,,exact-norm
1248,intervention,noun,3,,action taken to improve a medical condition or illness,noun,3,C1,per-def,C1,C1,match,,exact-norm
1249,intimacy,noun,1,,the state of having a close personal relationship with somebody,noun,1,C2,per-def,,C2,match,,exact-norm
