line_no,word,pos_list,sense_idx,sense_pos_chip,sense_text,source_pos,source_def_idx,source_cefr,source_cefr_origin,source_oxford_badge,declared_cefr,status,reason,match_kind
1830,rear,adjective|noun,1,,at or near the back of something,adjective,1,C1,oxford-badge,C1,C1,match,no-per-sense-pos-in-deck; flat-matched,exact-norm
1830,rear,adjective|noun,2,,the back part of something,noun,1,C1,per-def,C1,C1,match,no-per-sense-pos-in-deck; flat-matched,exact-norm
1831,reasonably,adverb,1,,to a degree that is fairly good but not very good,adverb,1,B2,per-def,B2,B2,match,,exact-norm
1831,reasonably,adverb,2,,in a logical and sensible way,adverb,2,B2,per-def,B2,B2,match,,exact-norm
1831,reasonably,adverb,3,,in a fair way,adverb,3,B2,per-def,B2,B2,match,,exact-norm
1832,reasoning,noun,1,,the process of thinking about things in a logical way; opinions and ideas that are based on logical thinking,noun,1,C1,oxford-badge,C1,C1,match,,exact-norm
1833,reassemble,verb,1,,to fit the parts of something together again after it has been taken apart,verb,1,UNCLASSIFIED,none,,UNCLASSIFIED,match,,exact-norm
1833,reassemble,verb,2,,to meet together again as a group after a break,verb,2,UNCLASSIFIED,none,,UNCLASSIFIED,match,,exact-norm
1834,reassure,verb,1,,to say or do something that makes somebody less frightened or worried,verb,1,C1,oxford-badge,C1,C1,match,,exact-norm
1835,rebel,noun,1,,"a person who fights against the government of their country ; a person who opposes somebody in authority over them within an organization, a political party, etc. ; a person who does not like to obey rules or who does not follow generally accepted standards of behaviour, dress, etc.",noun,3,C1,per-def,C1,C1,match,,fuzzy-jaccard=0.50
1836,rebellion,noun,1,,"an attempt by some of the people in a country to change their government, using violence",noun,1,C1,per-def,C1,C1,match,,exact-norm
1836,rebellion,noun,2,,"opposition to authority within an organization, a political party, etc.",noun,2,C1,per-def,C1,C1,match,,exact-norm
1836,rebellion,noun,3,,"opposition to authority; being unwilling to obey rules or accept normal standards of behaviour, dress, etc.",noun,3,C1,per-def,C1,C1,match,,exact-norm
1837,rebuild,verb,1,,"to build or make something complete and strong again, whether physically or figuratively",verb,2,B2,per-def,B2,B2,match,,fuzzy-jaccard=0.54
1838,receiver,noun,1,,the part of a phone that you hold close to your mouth and ear,noun,1,B2,per-def,B2,B2,match,,exact-norm
1838,receiver,noun,2,,a piece of radio or television equipment that changes broadcast signals into sound or pictures,noun,2,B2,per-def,B2,B2,match,,exact-norm
1839,receptor,noun,1,,a sense organ or nerve ending in the body that reacts to changes such as heat or cold and makes the body react in a particular way,noun,1,UNCLASSIFIED,none,,UNCLASSIFIED,match,,exact-norm
1840,recess,noun,1,,"a period of time during the year when the members of a parliament, committee, etc. do not meet",noun,1,C2,per-def,,C2,match,,exact-norm
1840,recess,noun,2,,a short break in a trial in court,noun,2,C2,per-def,,C2,match,,exact-norm
1840,recess,noun,3,,a period of time between lessons at school,noun,3,C2,per-def,,C2,match,,exact-norm
1841,recess,noun,1,,"a period of time during the year when the members of a parliament, committee, etc. do not meet",noun,1,C2,per-def,,UNCLASSIFIED,mismatch,"cefr-mismatch (deck=UNCLASSIFIED, source=C2 [per-def])",exact-norm
1841,recess,noun,2,,a short break in a trial in court,noun,2,C2,per-def,,UNCLASSIFIED,mismatch,"cefr-mismatch (deck=UNCLASSIFIED, source=C2 [per-def])",exact-norm
1841,recess,noun,3,,a period of time between lessons at school,noun,3,C2,per-def,,UNCLASSIFIED,mismatch,"cefr-mismatch (deck=UNCLASSIFIED, source=C2 [per-def])",exact-norm
1842,recession,noun,1,,"a difficult time for the economy of a country, when there is less trade and industrial activity than usual and more people are unemployed",noun,1,B2,per-def,B2,B2,match,,exact-norm
1843,recipient,noun,1,,a person who receives something,noun,1,C1,oxford-badge,C1,C1,match,,exact-norm
1844,reckon,verb,1,,to think something or have an opinion about something,verb,1,B2,per-def,B2,B2,match,,exact-norm
1845,recognition,noun,1,,"the act of remembering who somebody is when you see them, or of identifying what something is",noun,1,B2,per-def,B2,B2,match,,exact-norm
1846,reconstruction,noun,1,,"the process of changing or improving the condition of something or the way it works; the process of putting something back into the state it was in before ; the activity of building again something that has been damaged or destroyed ; a copy of something that no longer exists ; an act of acting out events that are known to have happened, in order to try and get more information or better understanding about what happened, especially a crime",noun,4,C1,per-def,C1,C1,match,,fuzzy-jaccard=0.50
1847,recount,verb,1,,"to tell somebody about something, especially something that you have experienced",,,,,,C1,mismatch,sense-text-not-in-source,none
1848,recovery,noun,1,,the process of becoming well again after an illness or injury,noun,1,B2,per-def,B2,B2,match,,exact-norm
1849,recruit,noun|verb,1,,"a person who has recently joined an organization, especially the armed forces, police, or a profession",noun,1,B2,per-def,B2,B2,match,no-per-sense-pos-in-deck; flat-matched,fuzzy-jaccard=0.71
1849,recruit,noun|verb,2,,"to find new people to join a company, an organization, the armed forces, etc.",verb,1,B2,per-def,B2,B2,match,no-per-sense-pos-in-deck; flat-matched,exact-norm
1849,recruit,noun|verb,3,,"to form a new army, team, etc. by persuading new people to join it",verb,3,B2,per-def,B2,B2,match,no-per-sense-pos-in-deck; flat-matched,exact-norm
1850,recruitment,noun,1,,"the act or process of finding new people to join a company, an organization, the armed forces, etc.",noun,1,B2,oxford-badge,B2,B2,match,,exact-norm
1851,redistribution,noun,1,,the act of sharing something out among people in a different way,noun,1,UNCLASSIFIED,none,,UNCLASSIFIED,match,,exact-norm
1852,referee,noun,1,,the official who controls the game in some sports,noun,1,B2,per-def,B2,B2,match,,exact-norm
1853,reference,verb,1,,"to refer to something; to provide a book, etc. with references",verb,1,B1,oxford-badge,B1,B1,match,,exact-norm
1854,referendum,noun,1,,an occasion when all the people of a country can vote on an important issue,noun,1,C1,oxford-badge,C1,C1,match,,exact-norm
1855,refine,verb,1,,to make a substance pure by taking other substances out of it,verb,1,C1,per-def,,C1,match,,exact-norm
1856,refine,verb,1,,to make a substance pure by taking other substances out of it,verb,1,C1,per-def,,UNCLASSIFIED,mismatch,"cefr-mismatch (deck=UNCLASSIFIED, source=C1 [per-def])",exact-norm
1857,reflection,noun,1,,"an image in a mirror, on a shiny surface, on water, etc.",noun,1,C1,per-def,C1,C1,match,,exact-norm
1857,reflection,noun,2,,a sign that shows the state or nature of something,noun,3,C1,per-def,C1,C1,match,,exact-norm
1857,reflection,noun,3,,"careful thought about something, sometimes over a long period of time",noun,4,C1,per-def,C1,C1,match,,exact-norm
1858,reform,noun|verb,1,,"change that is made to a social system, an organization, etc. in order to improve or correct it",noun,1,C1,oxford-badge,C1,C1,match,no-per-sense-pos-in-deck; flat-matched,exact-norm
1858,reform,noun|verb,2,,"to improve a system, an organization, a law, etc. by making changes to it",verb,1,C1,per-def,C1,C1,match,no-per-sense-pos-in-deck; flat-matched,exact-norm
1858,reform,noun|verb,3,,to improve your behaviour; to make somebody do this,verb,2,C1,per-def,C1,C1,match,no-per-sense-pos-in-deck; flat-matched,exact-norm
1859,refuge,noun,1,,"shelter or protection from danger, trouble, etc.",noun,1,C1,per-def,C1,C1,match,,exact-norm
1859,refuge,noun,2,,"a place, person or thing that provides shelter or protection for somebody/something",noun,2,C1,per-def,C1,C1,match,,exact-norm
1859,refuge,noun,3,,a building that provides a temporary home for people in need of shelter or protection from somebody/something,noun,3,C1,per-def,C1,C1,match,,exact-norm
1860,refugee,noun,1,,"a person who has been forced to leave their country or home, because there is a war or for political, religious or social reasons",noun,1,B2,oxford-badge,B2,B2,match,,exact-norm
1861,refusal,noun,1,,"an act of saying or showing that you will not do, give or accept something",noun,1,C1,oxford-badge,C1,C1,match,,exact-norm
1862,regain,verb,1,,"to get back something you no longer have, especially an ability or a quality",verb,1,C1,per-def,C1,C1,match,,exact-norm
1863,regardless,adverb,1,,"paying no attention, even if the situation is bad or there are difficulties",adverb,1,C1,oxford-badge,C1,C1,match,,exact-norm
1864,regime,noun,1,,"a method or system of government, especially one that has not been elected in a fair way",noun,1,C1,per-def,C1,C1,match,,exact-norm
1864,regime,noun,2,,a method or system of organizing or managing something,noun,2,C1,per-def,C1,C1,match,,exact-norm
1865,regional,adjective,1,,of or relating to a region,adjective,1,B2,oxford-badge,B2,B2,match,,exact-norm
1866,registration,noun,1,,the act of making an official record of something/somebody,noun,1,B2,per-def,B2,B2,match,,exact-norm
1867,regulate,verb,1,,to control something by means of rules,verb,1,B2,per-def,B2,B2,match,,exact-norm
1867,regulate,verb,2,,"to control the speed, pressure, temperature, etc. in a machine or system",verb,2,B2,per-def,B2,B2,match,,exact-norm
1868,regulation,noun,1,,an official rule made by a government or some other authority,noun,1,B2,per-def,B2,B2,match,,exact-norm
1869,regulator,noun,1,,a person or an organization that officially controls an area of business or industry and makes sure that it is operating fairly,noun,1,C1,per-def,C1,C1,match,,exact-norm
1869,regulator,noun,2,,"a device that controls something such as speed, temperature or pressure",noun,2,C1,per-def,C1,C1,match,,exact-norm
1870,regulatory,adjective,1,,having the power to control an area of business or industry and make sure that it is operating fairly,adjective,1,C1,oxford-badge,C1,C1,match,,exact-norm
1871,rehabilitation,noun,1,,"the process of helping somebody to return to a normal, healthy life after they have been in prison or very ill",noun,1,C1,per-def,C1,C1,match,,exact-norm
1872,reign,noun|verb,1,,"the period during which a king, queen, emperor, etc. rules",noun,1,C1,per-def,C1,C1,match,no-per-sense-pos-in-deck; flat-matched,exact-norm
1872,reign,noun|verb,2,,"to rule as king, queen, emperor, etc.",verb,1,C1,per-def,C1,C1,match,no-per-sense-pos-in-deck; flat-matched,exact-norm
1873,reinforce,verb,1,,"to make a feeling, an idea, etc. stronger",verb,1,B2,per-def,B2,B2,match,,exact-norm
1874,rejection,noun,1,,the act of refusing to accept or consider something,noun,1,C1,per-def,C1,C1,match,,exact-norm
1874,rejection,noun,2,,"the act of refusing to accept somebody for a job, position, etc.",noun,2,C1,per-def,C1,C1,match,,exact-norm
1874,rejection,noun,3,,"the decision not to use, sell, publish, etc. something because its quality is not good enough",noun,3,C1,per-def,C1,C1,match,,exact-norm
1875,relevance,noun,1,,a close connection with the subject you are discussing or the situation you are in,noun,1,C1,per-def,C1,C1,match,,exact-norm
1875,relevance,noun,2,,the fact of being valuable and useful to people in their lives and work,noun,2,C1,per-def,C1,C1,match,,exact-norm
1876,reliability,noun,1,,the quality of being able to be trusted to do what somebody wants or needs,noun,1,C1,per-def,C1,C1,match,,exact-norm
1876,reliability,noun,2,,the quality of being likely to be correct or true,noun,2,C1,per-def,C1,C1,match,,exact-norm
1876,reliability,noun,3,,the quality of being able to work or operate for long periods without breaking down or needing attention,noun,3,C1,per-def,C1,C1,match,,exact-norm
1877,relieve,verb,1,,to remove or reduce an unpleasant feeling or pain,verb,1,B2,per-def,B2,B2,match,,exact-norm
1878,relieved,adjective,1,,feeling happy because something unpleasant has stopped or has not happened; showing this,adjective,1,B2,oxford-badge,B2,B2,match,,exact-norm
1879,reluctance,noun,1,,"the feeling of being unwilling to do something and hesitating before you do it, because you do not want to do it or because you are not sure that it is the right thing to do",noun,1,UNCLASSIFIED,none,,UNCLASSIFIED,match,,exact-norm
1880,reluctant,adjective,1,,hesitating before doing something because you do not want to do it or because you are not sure that it is the right thing to do,adjective,1,C1,oxford-badge,C1,C1,match,,exact-norm
1881,remainder,noun,1,,"the people, things or time that remain",noun,1,C1,per-def,C1,C1,match,,exact-norm
1882,remains,noun,1,,"the parts of something that are left after the other parts have been used, eaten, removed, etc. ; the parts of ancient objects and buildings that have survived and are discovered in the present day ; the body of a dead person or animal",noun,1,C1,per-def,C1,C1,match,,fuzzy-jaccard=0.52
1883,remarkable,adjective,1,,unusual or surprising in a way that causes people to take notice,adjective,1,B2,oxford-badge,B2,B2,match,,exact-norm
1884,remarkably,adverb,1,,in a way that is unusual or surprising and causes people to take notice,adverb,1,B2,oxford-badge,B2,B2,match,,exact-norm
1885,remedy,noun,1,,a way of dealing with or improving an unpleasant or difficult situation,noun,1,C1,per-def,C1,C1,match,,exact-norm
1885,remedy,noun,2,,a treatment or medicine to cure a disease or reduce pain that is not very serious,noun,2,C1,per-def,C1,C1,match,,exact-norm
1886,reminder,noun,1,,"something that makes you think about or remember somebody/something, that you have forgotten or would like to forget ; a letter or note informing somebody that they have not done something",noun,1,C1,per-def,C1,C1,match,,fuzzy-jaccard=0.71
1887,removal,noun,1,,the act of taking something away or getting rid of it,noun,2,C1,per-def,C1,C1,match,,fuzzy-jaccard=0.60
1888,render,verb,1,,to cause somebody/something to be in a particular state or condition,verb,1,C1,per-def,C1,C1,match,,exact-norm
1888,render,verb,2,,"to give somebody something, especially in return for something or because it is expected",verb,2,C1,per-def,C1,C1,match,,exact-norm
1889,renew,verb,1,,to begin something again after it stopped or was interrupted,verb,1,C1,per-def,C1,C1,match,,exact-norm
1889,renew,verb,2,,to make something legally acceptable for a further period of time,verb,2,C1,per-def,C1,C1,match,,exact-norm
1889,renew,verb,3,,to emphasize something by saying or stating it again,verb,3,C1,per-def,C1,C1,match,,exact-norm
1890,renowned,adjective,1,,famous and respected,adjective,1,C1,oxford-badge,C1,C1,match,,exact-norm
1891,rental,noun,1,,the amount of money that you pay to use something for a particular period of time,noun,1,C1,per-def,C1,C1,match,,exact-norm
1891,rental,noun,2,,the act of renting something or an arrangement to rent something,noun,2,C1,per-def,C1,C1,match,,exact-norm
1891,rental,noun,3,,"a house, car or piece of equipment that you can rent",noun,3,C1,per-def,C1,C1,match,,exact-norm
1892,replacement,noun,1,,"the act of replacing one thing with another, especially something that is newer or better",noun,1,C1,per-def,C1,C1,match,,exact-norm
1892,replacement,noun,2,,"a thing that replaces something, especially because the first thing is old, broken, etc.",noun,2,C1,per-def,C1,C1,match,,exact-norm
1892,replacement,noun,3,,"a person who replaces another person in an organization, especially in their job",noun,3,C1,per-def,C1,C1,match,,exact-norm
1893,replenish,verb,1,,to make something full again by replacing what has been used,verb,1,UNCLASSIFIED,none,,UNCLASSIFIED,match,,exact-norm
1894,reportedly,adverb,1,,according to what some people say,adverb,1,C1,oxford-badge,C1,C1,match,,exact-norm
1895,reporting,noun,1,,"the presenting of and writing about news on television and radio, and in newspapers",noun,1,B2,oxford-badge,B2,B2,match,,exact-norm
1896,representation,noun,1,,the act of presenting somebody/something in a particular way; something that shows or describes something,noun,1,C1,per-def,C1,C1,match,,exact-norm
1896,representation,noun,2,,the fact of having representatives who will speak or vote for you or act in your place,noun,2,C1,per-def,C1,C1,match,,exact-norm
1897,reproduce,verb,1,,"to make a copy of a picture, piece of text, etc.",verb,1,C1,per-def,C1,C1,match,,exact-norm
1897,reproduce,verb,2,,to produce something very similar to something else in a different medium or context; to make something happen again in the same way,verb,2,C1,per-def,C1,C1,match,,exact-norm
1897,reproduce,verb,3,,"if people, plants, animals, etc. reproduce or reproduce themselves, they produce young",verb,3,C1,per-def,C1,C1,match,,exact-norm
1898,reproduction,noun,1,,"the act or process of producing babies, young animals or plants",noun,1,C1,per-def,C1,C1,match,,exact-norm
1898,reproduction,noun,2,,"the act or process of producing copies of a document, book, picture, etc.",noun,2,C1,per-def,C1,C1,match,,exact-norm
1898,reproduction,noun,3,,the quality of recorded sound,noun,3,C1,per-def,C1,C1,match,,exact-norm
1899,republic,noun,1,,a country that is governed by a president and politicians elected by the people and where there is no king or queen,noun,1,C1,oxford-badge,C1,C1,match,,exact-norm
1900,resemble,verb,1,,to look like or be similar to another person or thing,verb,1,C1,oxford-badge,C1,C1,match,,exact-norm
1901,reside,verb,1,,to live in a particular place,verb,1,C1,oxford-badge,C1,C1,match,,exact-norm
1902,residence,noun,1,,"a house, especially a large or impressive one",noun,1,C1,per-def,C1,C1,match,,exact-norm
1902,residence,noun,2,,the state of living in a particular place,noun,2,C1,per-def,C1,C1,match,,exact-norm
1903,residential,adjective,1,,suitable for living in; consisting of houses rather than factories or offices,adjective,1,C1,per-def,C1,C1,match,,exact-norm
1903,residential,adjective,2,,requiring a person to live at a particular place; offering living accommodation,adjective,2,C1,per-def,C1,C1,match,,exact-norm
1904,residue,noun,1,,a small amount of something that remains at the end of a process,noun,1,C1,per-def,C1,C1,match,,exact-norm
1905,resign,verb,1,,"to officially tell somebody that you are leaving your job, an organization, etc.",verb,1,B2,oxford-badge,B2,B2,match,,exact-norm
1906,resignation,noun,1,,the act of giving up your job or position; the occasion when you do this,noun,1,C1,per-def,C1,C1,match,,exact-norm
1906,resignation,noun,2,,"a letter, for example to your employers, to say that you are giving up your job or position",noun,2,C1,per-def,C1,C1,match,,exact-norm
1906,resignation,noun,3,,the quality of being willing to accept a difficult or unpleasant situation that you cannot change,noun,3,C1,per-def,C1,C1,match,,exact-norm
1907,resilient,adjective,1,,"returning to its original shape after being bent, stretched, or pressed",adjective,2,C2,per-def,,C2,match,,exact-norm
1908,resilient,adjective|noun,1,,"returning to its original shape after being bent, stretched, or pressed",adjective,2,C2,per-def,,UNCLASSIFIED,mismatch,"cefr-mismatch (deck=UNCLASSIFIED, source=C2 [per-def]); no-per-sense-pos-in-deck; flat-matched",exact-norm
1909,resistance,noun,1,,"dislike of or opposition to a plan, an idea, etc.; the act of refusing to obey",noun,1,C1,per-def,C1,C1,match,,exact-norm
1909,resistance,noun,2,,the act of using force to oppose somebody/something,noun,2,C1,per-def,C1,C1,match,,exact-norm
1909,resistance,noun,3,,the power not to be affected by something,noun,3,C1,per-def,C1,C1,match,,exact-norm
1910,resolution,noun,1,,a definite decision to do or not to do something,noun,1,B2,per-def,B2,B2,match,,exact-norm
1911,resource,noun,1,,"a supply of something that can be used to help achieve an aim, whether natural materials, money, or information",,,,,B1,B1,mismatch,sense-text-not-in-source,none
1912,respective,adjective,1,,belonging or relating separately to each of the people or things already mentioned,adjective,1,C1,oxford-badge,C1,C1,match,,exact-norm
1913,respectively,adverb,1,,in the same order as the people or things already mentioned,adverb,1,C1,oxford-badge,C1,C1,match,,exact-norm
1914,restoration,noun,1,,"the work of repairing and cleaning an old building, a painting, etc. so that its condition is as good as it originally was",noun,1,C1,per-def,C1,C1,match,,exact-norm
1914,restoration,noun,2,,"the act of bringing back a system, a law, etc. that existed previously",noun,2,C1,per-def,C1,C1,match,,exact-norm
1915,restorative,adjective,1,,connected with treatment that repairs the body or a part of it,adjective,2,C2,per-def,,C2,match,,exact-norm
1916,restorative,adjective,1,,connected with treatment that repairs the body or a part of it,adjective,2,C2,per-def,,UNCLASSIFIED,mismatch,"cefr-mismatch (deck=UNCLASSIFIED, source=C2 [per-def])",exact-norm
1917,restore,verb,1,,to bring back a situation or feeling that existed before,verb,1,B2,per-def,B2,B2,match,,exact-norm
1917,restore,verb,2,,"to bring somebody/something back to a former condition, place or position",verb,2,B2,per-def,B2,B2,match,,exact-norm
1917,restore,verb,3,,"to repair a building, work of art, piece of furniture, etc. so that it looks as good as it did originally",verb,3,B2,per-def,B2,B2,match,,exact-norm
1918,restrain,verb,1,,"to stop somebody/something from doing something, especially by using physical force",verb,1,UNCLASSIFIED,none,,UNCLASSIFIED,match,,exact-norm
1918,restrain,verb,2,,to stop yourself from feeling an emotion or doing something that you would like to do,verb,2,UNCLASSIFIED,none,,UNCLASSIFIED,match,,exact-norm
1918,restrain,verb,3,,to stop something that is growing or increasing from becoming too large,verb,3,UNCLASSIFIED,none,,UNCLASSIFIED,match,,exact-norm
1919,restraint,noun,1,,"a rule, a fact, an idea, etc. that limits or controls what people can do",noun,1,C1,per-def,C1,C1,match,,exact-norm
1919,restraint,noun,2,,the act of controlling or limiting something because it is necessary or sensible to do so,noun,2,C1,per-def,C1,C1,match,,exact-norm
1919,restraint,noun,3,,the quality of behaving calmly and with control,noun,3,C1,per-def,C1,C1,match,,exact-norm
1920,restrict,verb,1,,"to limit the size, amount or range of something",verb,1,B2,per-def,B2,B2,match,,exact-norm
1920,restrict,verb,2,,to stop somebody/something from moving or acting freely,verb,2,B2,per-def,B2,B2,match,,exact-norm
1920,restrict,verb,3,,to control something with rules or laws,verb,3,B2,per-def,B2,B2,match,,exact-norm
1921,restriction,noun,1,,a rule or law that limits what you can do or what can happen,noun,1,B2,per-def,B2,B2,match,,exact-norm
1922,restructuring,noun,1,,an act of organizing something such as a system or a company in a new and different way,noun,1,UNCLASSIFIED,none,,UNCLASSIFIED,match,,exact-norm
1923,resume,verb,1,,"if you resume an activity, or if it resumes, it begins again or continues after being interrupted",verb,1,C1,per-def,C1,C1,match,,exact-norm
1924,retail,noun,1,,"the selling of goods to the public, usually through shops",noun,1,B2,oxford-badge,B2,B2,match,,exact-norm
1925,retaliate,verb,1,,to do something harmful to somebody because they have harmed you first,verb,1,UNCLASSIFIED,none,,UNCLASSIFIED,match,,exact-norm
1926,retention,noun,1,,the action of keeping something rather than losing it or stopping it,noun,1,UNCLASSIFIED,none,,UNCLASSIFIED,match,,exact-norm
1926,retention,noun,2,,"the action of keeping liquid, heat, etc. inside something rather than letting it escape",noun,2,UNCLASSIFIED,none,,UNCLASSIFIED,match,,exact-norm
1926,retention,noun,3,,the ability to remember things,noun,3,UNCLASSIFIED,none,,UNCLASSIFIED,match,,exact-norm
1927,retirement,noun,1,,"the act of leaving your job and stopping work, usually at a particular age, or the period of your life after that",,,,,B2,B2,mismatch,sense-text-not-in-source,none
1928,retreat,noun|verb,1,,a movement away from a place or an enemy because of danger or defeat ; an act of trying to escape from a particular situation to one that you think is safer or more pleasant,noun,2,C1,per-def,C1,C1,match,no-per-sense-pos-in-deck; flat-matched,fuzzy-jaccard=0.72
1928,retreat,noun|verb,2,,to move away from a place or an enemy because you are in danger or because you have been defeated ; to move away or back ; to escape to a place that is quieter or safer,verb,1,C1,per-def,C1,C1,match,no-per-sense-pos-in-deck; flat-matched,fuzzy-jaccard=0.73
1929,retrieve,verb,1,,"to bring or get something back, especially from a place where it should not be",verb,1,C1,per-def,C1,C1,match,,exact-norm
1929,retrieve,verb,2,,to find and get back data or information that has been stored in the memory of a computer,verb,2,C1,per-def,C1,C1,match,,exact-norm
1930,revelation,noun,1,,"a fact that people are made aware of, especially one that has been secret and is surprising",noun,1,C1,per-def,C1,C1,match,,exact-norm
1930,revelation,noun,2,,the act of making people aware of something that has been secret,noun,2,C1,per-def,C1,C1,match,,exact-norm
1931,revenge,noun,1,,something that you do in order to make somebody suffer because they have made you suffer,noun,1,C1,per-def,C1,C1,match,,exact-norm
1932,revenue,noun,1,,"the money that a government receives from taxes or that an organization, etc. receives from its business",noun,1,B2,oxford-badge,B2,B2,match,,exact-norm
1933,reverse,adjective|noun|verb,1,,opposite to what has been mentioned,adjective,1,C1,per-def,C1,C1,match,no-per-sense-pos-in-deck; flat-matched,exact-norm
1933,reverse,adjective|noun|verb,2,,the opposite of what has just been mentioned,noun,1,C1,per-def,C1,C1,match,no-per-sense-pos-in-deck; flat-matched,exact-norm
1933,reverse,adjective|noun|verb,3,,the machine in a vehicle used to make it move backwards,noun,3,C1,per-def,C1,C1,match,no-per-sense-pos-in-deck; flat-matched,exact-norm
