line_no,word,pos_list,sense_idx,sense_pos_chip,sense_text,source_pos,source_def_idx,source_cefr,source_cefr_origin,source_oxford_badge,declared_cefr,status,reason,match_kind
7,abdominal,adjective,1,,relating to or connected with the abdomen,adjective,1,UNCLASSIFIED,none,,UNCLASSIFIED,match,,exact-norm
8,abolish,verb,1,,"to officially end a law, a system or an institution",verb,1,C1,oxford-badge,C1,C1,match,,exact-norm
9,abortion,noun,1,,"the deliberate ending of a pregnancy, whether by medical operation or other means",,,,,C1,C1,mismatch,sense-text-not-in-source,none
10,absence,noun,1,,the fact of somebody being away from a place where they are usually expected to be; the occasion or period of time when somebody is away,noun,1,C1,per-def,C1,C1,match,,exact-norm
10,absence,noun,2,,the fact of somebody/something not existing or not being available; a lack of something,noun,2,C1,per-def,C1,C1,match,,exact-norm
11,absent,adjective,1,,"not in a place because of illness, etc. ; not present in something",adjective,1,C1,per-def,C1,C1,match,,fuzzy-jaccard=0.78
12,absorb,verb,1,,to take in a substance or a form of energy from the surface or space around,verb,1,B2,per-def,B2,B2,match,,fuzzy-jaccard=0.62
13,abstract,adjective,1,,"based on general ideas and not on any particular real person, thing or situation ; existing in thought or as an idea but not having a physical reality ; not representing people or things in a realistic way, but expressing the artist’s ideas about them",,,,,B2,B2,mismatch,sense-text-not-in-source,none
14,absurd,adjective,1,,extremely silly; not logical and sensible,adjective,1,C1,per-def,C1,C1,match,,exact-norm
14,absurd,adjective,2,,things that are or that seem to be absurd,adjective,2,C1,per-def,C1,C1,match,,exact-norm
15,abundance,noun,1,,a large quantity that is more than enough,noun,1,C1,oxford-badge,C1,C1,match,,exact-norm
16,abundant,adjective,1,,existing in large quantities; more than enough,adjective,1,UNCLASSIFIED,none,,UNCLASSIFIED,match,,exact-norm
17,abuse,noun|verb,1,,the use of something in a way that is wrong or harmful,noun,1,C1,per-def,C1,C1,match,no-per-sense-pos-in-deck; flat-matched,exact-norm
17,abuse,noun|verb,2,,"unfair, cruel or violent treatment of somebody",noun,2,C1,per-def,C1,C1,match,no-per-sense-pos-in-deck; flat-matched,exact-norm
17,abuse,noun|verb,3,,"rude and offensive remarks, usually made when somebody is very angry",noun,3,C1,per-def,C1,C1,match,no-per-sense-pos-in-deck; flat-matched,exact-norm
18,academy,noun,1,,a school or college for special training,noun,1,C1,per-def,C1,C1,match,,exact-norm
19,accelerate,verb,1,,to happen faster or earlier; to make something happen faster or earlier,verb,1,C1,per-def,C1,C1,match,,exact-norm
19,accelerate,verb,2,,to start to go faster,verb,2,C1,per-def,C1,C1,match,,exact-norm
20,accent,noun,1,,"a way of pronouncing the words of a language that shows which country, area or social class a person comes from; how well somebody pronounces a particular language",noun,1,B2,per-def,B2,B2,match,,exact-norm
20,accent,noun,2,,the emphasis that you should give to part of a word when saying it,noun,2,B2,per-def,B2,B2,match,,exact-norm
20,accent,noun,3,,a mark on a letter to show that it should be pronounced in a particular way,noun,3,B2,per-def,B2,B2,match,,exact-norm
21,acceptance,noun,1,,"the act of accepting a gift, an invitation, an offer, etc.",noun,1,C1,per-def,C1,C1,match,,exact-norm
21,acceptance,noun,2,,the act of agreeing with something and approving of it,noun,2,C1,per-def,C1,C1,match,,exact-norm
21,acceptance,noun,3,,the process of allowing somebody to join something or be a member of a group,noun,3,C1,per-def,C1,C1,match,,exact-norm
22,accessible,adjective,1,,"that can be reached, entered, used, seen, etc.",adjective,1,C1,per-def,C1,C1,match,,exact-norm
22,accessible,adjective,2,,"that can be reached, entered, used, etc. by somebody who has problems walking",adjective,2,C1,per-def,C1,C1,match,,exact-norm
22,accessible,adjective,3,,easy to understand,adjective,3,C1,per-def,C1,C1,match,,exact-norm
23,accidentally,adverb,1,,by chance; in a way that was not planned,adverb,1,B2,oxford-badge,B2,B2,match,,exact-norm
24,accommodate,verb,1,,"to provide somebody with a room or place to sleep, live or sit",verb,1,B2,per-def,B2,B2,match,,exact-norm
25,accomplish,verb,1,,to succeed in doing or completing something,verb,1,B2,per-def,B2,B2,match,,exact-norm
26,accomplishment,noun,1,,an impressive thing that is done or achieved after a lot of work,noun,1,C1,per-def,C1,C1,match,,exact-norm
26,accomplishment,noun,2,,a skill or special ability,noun,2,C1,per-def,C1,C1,match,,exact-norm
26,accomplishment,noun,3,,the successful completing of something,noun,3,C1,per-def,C1,C1,match,,exact-norm
27,accordingly,adverb,1,,in a way that is appropriate to what has been done or said in a particular situation,adverb,1,C1,per-def,C1,C1,match,,exact-norm
27,accordingly,adverb,2,,for that reason,adverb,2,C1,per-def,C1,C1,match,,exact-norm
28,accountability,noun,1,,the fact of being responsible for your decisions or actions and expected to explain them when you are asked,noun,1,C1,oxford-badge,C1,C1,match,,exact-norm
29,accountable,adjective,1,,responsible for your decisions or actions and expected to explain them when you are asked,adjective,1,C1,oxford-badge,C1,C1,match,,exact-norm
30,accountant,noun,1,,a person whose job is to keep or check financial accounts,noun,1,B2,oxford-badge,B2,B2,match,,exact-norm
31,accumulate,verb,1,,"to gradually get more and more of something, or to gradually increase in amount, over a period of time",verb,1,C1,per-def,C1,C1,match,,fuzzy-jaccard=0.71
32,accumulation,noun,1,,the process of gradually increasing or getting more and more of something over a period of time,noun,1,C1,per-def,C1,C1,match,,exact-norm
32,accumulation,noun,2,,an amount of something that has gradually increased over a period of time,noun,2,C1,per-def,C1,C1,match,,exact-norm
33,accuracy,noun,1,,the state of being exact or correct; the ability to do something with skill and without making mistakes,noun,1,B2,per-def,B2,B2,match,,exact-norm
33,accuracy,noun,2,,"the degree to which a measurement, calculation, etc. is exact or correct",noun,2,B2,per-def,B2,B2,match,,exact-norm
34,accurately,adverb,1,,in a way that is correct and true in every detail,adverb,1,B2,per-def,B2,B2,match,,exact-norm
34,accurately,adverb,2,,in an exact way,adverb,2,B2,per-def,B2,B2,match,,exact-norm
34,accurately,adverb,3,,hitting or reaching the thing that was aimed at,adverb,3,B2,per-def,B2,B2,match,,exact-norm
35,accusation,noun,1,,a statement saying that you think a person is guilty of doing something wrong or illegal; the fact of accusing somebody,noun,1,C1,oxford-badge,C1,C1,match,,exact-norm
36,acid,noun,1,,"a chemical, usually a liquid, that contains hydrogen and has a pH of less than seven. The hydrogen can be replaced by a metal to form a salt. Acids usually have a bitter sharp taste and can often burn holes in or damage things they touch.",noun,1,B2,per-def,C1,B2,match,,exact-norm
37,acknowledge,verb,1,,to accept that something is true ; to accept that somebody/something has a particular authority or status,verb,2,B2,per-def,B2,B2,match,,fuzzy-jaccard=0.83
38,acquisition,noun,1,,"the act of getting something, especially knowledge, a skill, etc. ; something that somebody buys to add to what they already own, usually something valuable ; a company, piece of land, etc. bought by somebody, especially another company; the act of buying it",noun,3,C1,per-def,C1,C1,match,,fuzzy-jaccard=0.50
39,acre,noun,1,,a unit for measuring an area of land; 4 840 square yards or about 4 050 square metres,noun,1,C1,oxford-badge,C1,C1,match,,exact-norm
40,activate,verb,1,,to make something such as a device or chemical process start working,verb,1,B2,oxford-badge,B2,B2,match,,exact-norm
41,activation,noun,1,,the act of making something such as a device or chemical process start working,noun,1,C1,oxford-badge,C1,C1,match,,exact-norm
42,activist,noun,1,,"a person who works to achieve political or social change, especially as a member of an organization with particular aims",noun,1,C1,oxford-badge,C1,C1,match,,exact-norm
43,acute,adjective,1,,very serious or severe,adjective,1,C1,per-def,C1,C1,match,,exact-norm
43,acute,adjective,2,,an acute illness is one that has quickly become severe and dangerous,adjective,2,C1,per-def,C1,C1,match,,exact-norm
43,acute,adjective,3,,very sensitive and well developed,adjective,4,C1,per-def,C1,C1,match,,exact-norm
44,adapt,verb,1,,to change your behaviour in order to deal more successfully with a new situation,verb,1,B2,per-def,B2,B2,match,,exact-norm
44,adapt,verb,2,,to change something in order to make it suitable for a new use or situation,verb,2,B2,per-def,B2,B2,match,,exact-norm
44,adapt,verb,3,,"to change a book or play so that it can be made into a play, film, television drama, etc.",verb,3,B2,per-def,B2,B2,match,,exact-norm
45,adaptation,noun,1,,"the action or process of changing something, or of being changed, to suit a new purpose or situation",noun,1,C1,per-def,C1,C1,match,,exact-norm
45,adaptation,noun,2,,"a film, television drama or play that is based on a particular book or play but has been changed to suit the new medium",noun,2,C1,per-def,C1,C1,match,,exact-norm
46,addiction,noun,1,,"the condition of being unable to stop using or doing something as a habit, especially something harmful",noun,1,B2,oxford-badge,B2,B2,match,,exact-norm
47,addictive,adjective,1,,"if a substance or activity is addictive, it makes people unable to stop using it or doing it",adjective,1,C1,per-def,,C1,match,,exact-norm
48,additionally,adverb,1,,in a way that is more than was first mentioned or is usual,adverb,1,B2,oxford-badge,B2,B2,match,,exact-norm
49,adequate,adjective,1,,"enough in quantity, or good enough in quality, for a particular purpose or need",adjective,1,B2,oxford-badge,B2,B2,match,,exact-norm
50,adequately,adverb,1,,"in a way that is enough in quantity, or good enough in quality, for a particular purpose or need",adverb,1,B2,oxford-badge,B2,B2,match,,exact-norm
51,adhere,verb,1,,to stick to something,verb,1,C1,oxford-badge,C1,C1,match,,exact-norm
52,adjacent,adjective,1,,next to something,adjective,1,C1,oxford-badge,C1,C1,match,,exact-norm
53,adjust,verb,1,,to change something slightly to make it more suitable for a new set of conditions or to make it work better,verb,1,B2,per-def,B2,B2,match,,exact-norm
53,adjust,verb,2,,to get used to a new situation by changing the way you behave and/or think,verb,2,B2,per-def,B2,B2,match,,exact-norm
54,adjustment,noun,1,,a small change made to something in order to correct or improve it,noun,1,C1,per-def,C1,C1,match,,exact-norm
54,adjustment,noun,2,,a change in the way a person behaves or thinks,noun,2,C1,per-def,C1,C1,match,,exact-norm
55,administer,verb,1,,"to manage and organize the affairs of a company, an organization, a country, etc.",verb,1,C1,per-def,C1,C1,match,,exact-norm
55,administer,verb,2,,to make sure that something is done fairly and in the correct way,verb,2,C1,per-def,C1,C1,match,,exact-norm
55,administer,verb,3,,"to give or to provide something, especially in a formal way",verb,3,C1,per-def,C1,C1,match,,exact-norm
56,administrative,adjective,1,,connected with organizing the work of a business or an institution,adjective,1,C1,oxford-badge,C1,C1,match,,exact-norm
57,administrator,noun,1,,"a person whose job is to manage and organize the public or business affairs of a company or an institution, or a person who works in an office dealing with records, accounts, etc.",noun,1,C1,per-def,C1,C1,match,,exact-norm
58,admissible,adjective,1,,"that can be allowed or accepted, especially in court",adjective,1,UNCLASSIFIED,none,,UNCLASSIFIED,match,,exact-norm
59,admission,noun,1,,"the act of accepting somebody into an institution, organization, etc.; the right to enter a place or to join an institution or organization",noun,1,C1,per-def,C1,C1,match,,exact-norm
59,admission,noun,2,,"a statement in which somebody admits that something is true, especially something wrong or bad that they have done",noun,2,C1,per-def,C1,C1,match,,exact-norm
59,admission,noun,3,,the amount of money that you pay to go into a building or to an event,noun,3,C1,per-def,C1,C1,match,,exact-norm
60,adolescence,noun,1,,the time in a person’s life when they develop from a child into an adult,noun,1,UNCLASSIFIED,none,,UNCLASSIFIED,match,,exact-norm
61,adolescent,noun,1,,a young person who is developing from a child into an adult,noun,1,C1,oxford-badge,C1,C1,match,,exact-norm
62,adoption,noun,1,,the act of adopting a child; the fact of being adopted,noun,1,C1,per-def,C1,C1,match,,exact-norm
62,adoption,noun,2,,"the decision to start using something such as an idea, a plan or a name",noun,2,C1,per-def,C1,C1,match,,exact-norm
63,adverse,adjective,1,,negative and unpleasant; not likely to produce a good result,adjective,1,C1,oxford-badge,C1,C1,match,,exact-norm
64,advocate,noun,1,,a person who supports or speaks in favour of somebody or of a public plan or action,noun,1,C1,per-def,C1,C1,match,,exact-norm
65,aesthetic,adjective,1,,connected with beauty and art and the understanding of beautiful things,adjective,1,C1,per-def,C1,C1,match,,exact-norm
66,affirm,verb,1,,to confirm a legal decision,verb,3,C1,per-def,,C1,match,,exact-norm
67,affirm,verb,1,,to confirm a legal decision,verb,3,C1,per-def,,UNCLASSIFIED,mismatch,"cefr-mismatch (deck=UNCLASSIFIED, source=C1 [per-def])",exact-norm
68,affordable,adjective,1,,cheap enough that people can afford to pay it or buy it,adjective,1,B2,oxford-badge,B2,B2,match,,exact-norm
69,aftermath,noun,1,,"the situation that exists as a result of an important (and usually unpleasant) event, especially a war, an accident, etc.",noun,1,C1,oxford-badge,C1,C1,match,,exact-norm
70,aggregate,adjective|noun|verb,1,,made up of several amounts that are added together to form a total number,adjective,1,UNCLASSIFIED,none,,UNCLASSIFIED,match,no-per-sense-pos-in-deck; flat-matched,exact-norm
70,aggregate,adjective|noun|verb,2,,a total number or amount made up of smaller amounts that are collected together,noun,1,C2,per-def,,UNCLASSIFIED,mismatch,"cefr-mismatch (deck=UNCLASSIFIED, source=C2 [per-def]); no-per-sense-pos-in-deck; flat-matched",exact-norm
70,aggregate,adjective|noun|verb,3,,"to put together different items, amounts, etc. into a single group or total",verb,1,UNCLASSIFIED,none,,UNCLASSIFIED,match,no-per-sense-pos-in-deck; flat-matched,exact-norm
71,aggression,noun,1,,feelings of anger and hate that may result in threatening or violent behaviour ; a violent attack or threats by one person against another person or by one country against another country,noun,1,C1,per-def,C1,C1,match,,fuzzy-jaccard=0.62
72,agile,adjective,1,,able to think quickly and in an intelligent way,adjective,2,C2,per-def,,C2,match,,exact-norm
72,agile,adjective,2,,"used to describe a way of managing projects in which work is divided into a series of short tasks, with regular breaks to review the work and adapt the plans",adjective,3,C2,per-def,,C2,match,,exact-norm
72,agile,adjective,3,,"used to describe a way of working in which the time and place of work, and the roles that people carry out, can all be changed according to need, and the focus is on the goals to be achieved, rather than the exact methods used",adjective,4,C2,per-def,,C2,match,,exact-norm
73,agile,adjective,1,,able to think quickly and in an intelligent way,adjective,2,C2,per-def,,UNCLASSIFIED,mismatch,"cefr-mismatch (deck=UNCLASSIFIED, source=C2 [per-def])",exact-norm
73,agile,adjective,2,,"used to describe a way of managing projects in which work is divided into a series of short tasks, with regular breaks to review the work and adapt the plans",adjective,3,C2,per-def,,UNCLASSIFIED,mismatch,"cefr-mismatch (deck=UNCLASSIFIED, source=C2 [per-def])",exact-norm
73,agile,adjective,3,,"used to describe a way of working in which the time and place of work, and the roles that people carry out, can all be changed according to need, and the focus is on the goals to be achieved, rather than the exact methods used",adjective,4,C2,per-def,,UNCLASSIFIED,mismatch,"cefr-mismatch (deck=UNCLASSIFIED, source=C2 [per-def])",exact-norm
74,agricultural,adjective,1,,connected with the science or practice of farming,adjective,1,C1,oxford-badge,C1,C1,match,,exact-norm
75,agriculture,noun,1,,the science or practice of farming,noun,1,B2,oxford-badge,B2,B2,match,,exact-norm
76,aide,noun,1,,"a person who helps another person, especially a politician, in their job",noun,1,C1,oxford-badge,C1,C1,match,,exact-norm
77,AIDS,noun,1,,a serious illness caused by a virus called HIV that attacks the body’s ability to resist infection (the abbreviation for ‘Acquired Immune Deficiency Syndrome’),noun,1,B2,oxford-badge,B2,B2,match,,exact-norm
78,ailment,noun,1,,an illness that is not very serious,noun,1,UNCLASSIFIED,none,,UNCLASSIFIED,match,,exact-norm
79,albeit,conjunction,1,,although,conjunction,1,C1,oxford-badge,C1,C1,match,,exact-norm
80,alert,adjective|noun|verb,1,,"able to think quickly and notice things, especially possible dangers or problems",,,,,C1,C1,mismatch,sense-text-not-in-source; no-per-sense-pos-in-deck; flat-matched,none
80,alert,adjective|noun|verb,2,,a situation in which people are watching for danger and ready to deal with it,noun,1,C1,per-def,C1,C1,match,no-per-sense-pos-in-deck; flat-matched,exact-norm
80,alert,adjective|noun|verb,3,,a warning of danger or of a problem,noun,2,C1,per-def,C1,C1,match,no-per-sense-pos-in-deck; flat-matched,exact-norm
81,alien,noun,1,,a person who is not a citizen of the country in which they live or work,noun,1,B2,per-def,C1,B2,match,,exact-norm
81,alien,noun,2,,a creature from another world,noun,2,B2,per-def,C1,B2,match,,exact-norm
82,align,verb,1,,"to arrange something in the correct position, or to be in the correct position, in relation to something else, especially in a straight line",verb,1,C1,per-def,C1,C1,match,,exact-norm
82,align,verb,2,,to change something slightly so that it is in the correct relationship to something else,verb,2,C1,per-def,C1,C1,match,,exact-norm
83,alignment,noun,1,,arrangement in a straight line,noun,1,C1,per-def,C1,C1,match,,exact-norm
83,alignment,noun,2,,"political, business or other support given to one country or group by another",noun,3,C1,per-def,C1,C1,match,,exact-norm
84,alike,adjective|adverb,1,,very similar,adjective,1,C1,oxford-badge,C1,C1,match,no-per-sense-pos-in-deck; flat-matched,exact-norm
84,alike,adjective|adverb,2,,in a very similar way,adverb,1,C1,per-def,C1,C1,match,no-per-sense-pos-in-deck; flat-matched,exact-norm
85,allegation,noun,1,,"a public statement that is made without giving proof, accusing somebody of doing something that is wrong or illegal",noun,1,C1,oxford-badge,C1,C1,match,,exact-norm
86,allege,verb,1,,to state something as a fact but without giving proof,verb,1,C1,oxford-badge,C1,C1,match,,exact-norm
87,allegedly,adverb,1,,expressed as though something is a fact but without giving any proof,adverb,1,C1,oxford-badge,C1,C1,match,,exact-norm
88,alliance,noun,1,,"an agreement between countries, political parties, etc. to work together in order to achieve something that they all want ; a group of people, political parties, etc. who work together in order to achieve something that they all want",noun,1,C1,per-def,C1,C1,match,,fuzzy-jaccard=0.82
89,allocate,verb,1,,to give something officially to somebody/something for a particular purpose,verb,1,C1,oxford-badge,C1,C1,match,,exact-norm
90,allocation,noun,1,,"an amount of money, space, etc. that is given to somebody for a particular purpose",noun,1,C1,per-def,C1,C1,match,,exact-norm
90,allocation,noun,2,,the act of giving something to somebody for a particular purpose,noun,2,C1,per-def,C1,C1,match,,exact-norm
91,allowance,noun,1,,an amount of money that is given to somebody regularly or for a particular purpose,noun,1,C1,per-def,C1,C1,match,,exact-norm
91,allowance,noun,2,,the amount of something that is allowed in a particular situation,noun,2,C1,per-def,C1,C1,match,,exact-norm
91,allowance,noun,3,,"a small amount of money that parents give their children, usually every week or every month",noun,3,C1,per-def,C1,C1,match,,exact-norm
92,ally,noun,1,,"a country that has agreed to help and support another country, especially in case of a war",noun,1,C1,per-def,C1,C1,match,,exact-norm
92,ally,noun,2,,"a person who helps and supports somebody who is in a difficult situation, especially a politician",noun,2,C1,per-def,C1,C1,match,,exact-norm
92,ally,noun,3,,the group of countries including the UK and the US that fought together in the First and Second World Wars,noun,4,C1,per-def,C1,C1,match,,exact-norm
93,alongside,preposition,1,,next to or at the side of something,preposition,1,B2,per-def,B2,B2,match,,exact-norm
93,alongside,preposition,2,,together with or at the same time as something/somebody,preposition,2,B2,per-def,B2,B2,match,,exact-norm
94,altogether,adverb,1,,(used to emphasize something) completely; in every way,adverb,1,B2,per-def,B2,B2,match,,exact-norm
94,altogether,adverb,2,,used to give a total number or amount,adverb,2,B2,per-def,B2,B2,match,,exact-norm
94,altogether,adverb,3,,used to introduce a summary when you have mentioned a number of different things,adverb,3,B2,per-def,B2,B2,match,,exact-norm
95,aluminium,noun,1,,"a chemical element. Aluminium is a light, silver-grey metal used for making pans, etc.",noun,1,C1,oxford-badge,C1,C1,match,,exact-norm
96,amateur,adjective|noun,1,,"doing something for pleasure or interest, not as a job",adjective,1,C1,per-def,C1,C1,match,no-per-sense-pos-in-deck; flat-matched,exact-norm
96,amateur,adjective|noun,2,,"done for pleasure, not as a job",adjective,2,C1,per-def,C1,C1,match,no-per-sense-pos-in-deck; flat-matched,exact-norm
96,amateur,adjective|noun,3,,not done or made well or with skill,adjective,3,C1,per-def,C1,C1,match,no-per-sense-pos-in-deck; flat-matched,exact-norm
97,ambassador,noun,1,,an official who lives in a foreign country as the senior representative there of their own country,noun,1,C1,per-def,C1,C1,match,,exact-norm
98,ambiguous,adjective,1,,"able to be understood in more than one way, or not clearly stated or defined",,,,,,UNCLASSIFIED,mismatch,sense-text-not-in-source,none
99,ambition,noun,1,,something that you want to do or achieve very much,noun,1,B1,per-def,B1,B1,match,,exact-norm
99,ambition,noun,2,,"the desire or strength of mind to be successful, rich, powerful, etc.",noun,2,B1,per-def,B1,B1,match,,exact-norm
100,ambulance,noun,1,,"a vehicle with special equipment, used for taking sick or injured people to a hospital",noun,1,B2,oxford-badge,B2,B2,match,,exact-norm
101,amend,verb,1,,"to change a law, document, statement, etc. slightly in order to correct a mistake or to improve it",verb,1,C1,oxford-badge,C1,C1,match,,exact-norm
102,amendment,noun,1,,a small change or improvement that is made to a document or proposed new law; the process of changing a document or proposed new law,noun,1,C1,per-def,C1,C1,match,,exact-norm
103,amid,preposition,1,,"in the middle of or during something, especially something that causes excitement or fear",preposition,1,C1,per-def,C1,C1,match,,exact-norm
103,amid,preposition,2,,surrounded by something,preposition,2,C1,per-def,C1,C1,match,,exact-norm
104,amusing,adjective,1,,funny and giving pleasure,adjective,1,B2,oxford-badge,B2,B2,match,,exact-norm
105,analogy,noun,1,,a comparison of one thing with another thing that has similar features; a feature that is similar ; the process of comparing one thing with another thing that has similar features in order to explain it,noun,2,C1,per-def,C1,C1,match,,fuzzy-jaccard=0.85
106,analyst,noun,1,,a person whose job involves examining facts or materials in order to give an opinion on them,noun,1,B2,per-def,B2,B2,match,,exact-norm
107,analytical,adjective,1,,"using a logical method of thinking about something in order to understand it, especially by looking at all the parts separately",adjective,1,UNCLASSIFIED,none,,UNCLASSIFIED,match,,exact-norm
107,analytical,adjective,2,,using scientific analysis in order to find out about something,adjective,2,UNCLASSIFIED,none,,UNCLASSIFIED,match,,exact-norm
108,ancestor,noun,1,,a person in your family who lived a long time ago,noun,1,B2,per-def,B2,B2,match,,exact-norm
109,anchor,noun,1,,a heavy metal object that is attached to a rope or chain and dropped over the side of a ship or boat to keep it in one place,noun,1,C1,per-def,C1,C1,match,,exact-norm
109,anchor,noun,2,,a person or thing that gives somebody a feeling of safety,noun,2,C1,per-def,C1,C1,match,,exact-norm
109,anchor,noun,3,,a person who presents a live radio or television programme and introduces reports by other people; an anchorman or anchorwoman,noun,3,C1,per-def,C1,C1,match,,exact-norm
110,anecdote,noun,1,,"a short, interesting or funny story about a real person or event",noun,1,B2,per-def,,B2,match,,exact-norm
111,anecdote,noun,1,,"a short, interesting or funny story about a real person or event",noun,1,B2,per-def,,UNCLASSIFIED,mismatch,"cefr-mismatch (deck=UNCLASSIFIED, source=B2 [per-def])",exact-norm
112,angel,noun,1,,"a spirit who is believed to be a servant of God, and is sent by God to deliver a message or perform a task. Angels are often shown dressed in white, with wings.",noun,1,C1,per-def,C1,C1,match,,exact-norm
112,angel,noun,2,,a person who is very good and kind; a child who behaves well,noun,2,C1,per-def,C1,C1,match,,exact-norm
112,angel,noun,3,,used when you are talking to somebody and you are grateful to them,noun,3,C1,per-def,C1,C1,match,,exact-norm
113,animation,noun,1,,"the process of making films, videos and computer games in which drawings, models or images of people and animals seem to move",noun,1,B2,per-def,B2,B2,match,,exact-norm
